,comment_body
877,This is excellent!!! I would like to place my oder now for the holidays.  Do I order them at school?
878,This is how I feel when dealing with 8th grade girl drama!
879,Fabulous cause.  Let me know when the next one takes place.
880,Way to go! I\'d love o buy a pie. :)
881,was this at PVEI?
882,This pie look delicious.  Do you deliver?
883,Just watch the camera footage the next day.
884,Inspiring story. Makes me want to go out there and watch somebody else run.
885,I am so very proud of you accomplishments!  Way to go!
886,I love marbles.
887,Great image- this captures the  angst we are hoping to prevent in PV graduates!
888,There was no better training for Administration than customer relations.  Nice job.  I need to work on my picture skills.
889,Very cool!  Well deserved!
890,Ahhh.....I miss these times :(
891,Beautiful . . . didn\'t know this!
892,la la la la la la la.....singing shows you are outgoing!  Great entry
893,You are so talented! Thanks for sharing your fun ideas.
894,That was a wonderful event.  You guys did a great job making that night a positive experience for the kids.
895,I would love to hear you sing.
896,What was the shop\'s policy on multiple flavors on single cones? You did a sweet job writing this up.
897,Excellent initiative.  Are you planning to sell any at work soon?
898,"How cute! What a nice way to spend community service hours, helping a baby bird!"
899,This is so cool!
900,Woohoo!
901,Thumper is so cute!
902,Did you ever lose your marbles while doing this?
903,What a wonderful experience!  The Kids at PV are lucky to have you.
904,Working with at-risk youth shows that you are adaptive and a risk taker!  Great entry!
905,This can be very challenging!
906,I love this description- the kids submitted many awesome pics for this event for yearbook.  It was an amazing team building activity.
907,Smart decision!  So proud of you!
908,Congratulations!
909,What an amazing opportunity and definitely creating some great Interpersonal Skills! And what a beautiful dress!
910,Wow! This should be nominated for Principal of the Year.
911,. . . reminds me of my trip last spring . . . missing Disney:)
912,Hooray for mental health!!  ;)
913,Sounds like a fun job!
914,The picture is upside down!
915,"I have decided that if I make it to 2022, I will come visit.  Invited or not!!!!!!"
916,Woah!! This is amazing! Congratulations!
917,What did you do?   What presentations did you give?
918,This is very nice!  I think I could have my children make gifts like this for family gifts this year.
919,"Although we lost a great administrator, that is a fine piece of jewelry."
920,Where is this?  We need it at the elementary level!
921,"Unfortunately, the money spent at 2000 Degrees that day could have been better spent on parenting classes."
922,Being a behavior specialist is quite the job in education.  It was great experience I am sure.
923,How did going to camp next to a sublime ocean make you feel?
924,"Well done writing succinctly, but in a meaningful way, how you relate to these three different works and what they symbolize for you."
925,"You should look in to our Maymester trip to Lyon, France. It is a wonderful opportunity to explore both cuisine and culture and you could practice your French language and get some of those skills back (in a hurry, I suspect.)"
926,"I believe that the ability to identify with piece of art is what makes it so beautiful. Now that you have identified pieces of art that you can relate different events in your life to, you are more likely to be able reflect on the lessons you learned in those experiences. This is exactly what happened to you. Adaptability, self-awareness, and creativity are all great skills to have in order to be successful in life."
927,"I love the imagery that you are creating with your word choice in the beginning. As I read your post I feel like I am there. Your father\'s dedication to teaching you the sport of track seems like it has been huge in your development. I believe that teaches you a lot of lesson, including leadership, that will make you the best all around professional you can be."
928,"This is fantastic!!! As a fellow gamer, I find it really impressive that you go out of your way to do things other women have not really stepped heavily into yet! This also shows a great deal of organization with the size of your group."
929,This is nice that you admitted the mistake of incorrectly creating a bowl for your teammate. Also it shows that you had the drive and dedication to get back up and make another bowl they were dissatisfied with. This also shows emotional intelligence that you reacted to the dissatisfaction that you had noticed and acknowledged it.
930,This was a great experience to write about.  This was a good stepping stone back story post for the more recent posts you have.
931,"Luke, you are the living example of, \""""alone we can do so little, together we can do so much,\"""" and that is amazing! Your behind the scenes contribution helped to make THON be the best it could be, and for that reason, you make a great role model. Keep it up!"
932,"So glad to hear you found this engaging and are excited to explore further.  This was a first for my PSU14 sections, so I\'m really glad it hit the mark for at least one student!"
933,Interesting challenge and a good way to demonstrate your team building skills.
934,"What\'s up Jonathon! This is a great entry, you not only shared your experience, but reflected upon it as well. This is a great way to show your value in the classroom, and workplace. Keep up the good work!"
935,I would use this continuation to further explain your personal use of the skills.
936,"Regardless of the fact you refused to talk about work, at least you were able to connect and engage with your team through other topics. These types of events are imperative for strengthening group connections which in term strengthens the qualities of projects."
937,This looks like an awesome experience Ricky.  I would love to hear this better version of \'Super Bass\'.  I certainly don\'t have the talent to perform but respect the courage it took to get on stage and nail a song.  Congrats.
938,CAD is a super useful skill to have! It is great you voiced this technical skill in addition to your soft skills in this post!
939,"This is a really great organization to get involved in. THON is recognized by many people everywhere you go, helping people like this shows the heart and caring you have for people which is great in a workplace environment and life in itself."
940,All these experiences of leadership and community involvement are great! Keep up the good work!
941,I really think that you should expand on this post based on your skills you put as the tags.
942,I am happy that you were able to get a better understanding of ethics. Ethics are very important to your success at PSU and in the corporate world. Also love how you end this post by saying that you arent perfect but you will make a cognitive effort to be as ethical as possible.
943,"This is a great lesson to learn early. Privacy is important when you are working in healthcare. In health care people are coming to you in their most vulnerable states, which means they expect you to keep all of their information. Also it is Important to respect privacy in healthcare because if you don\'t you could leave your organization open to huge fines.  "
944,I like how you were able to take this stroll down memory and connect all of your experiences to you current life at penn state. It is impressive that you were able to make the varsity team as a freshmen it shows that you are not only a gifted athlete but a hard worker. This experience shows that you have the ability and willingness to learn from your elders in order to improve your skills.
945,Great post. Privacy is so important especially if you want to work in health care. People come to healthcare facilities in their most vulnerable states so keeping what they share with you private is pertinent. Also there are a lot of regulation in healthcare that if you don\'t keep patient information private the organization can be subject to huge fines.
946,"First off I completely agree with you that the media has a huge impact on our lives. Especially with social media, we have become dependent on them for the newest trends and update us on the world news. Also I agree that our generation is hampered by this dependence on technology such as our cell phones. I think that this conversation will serve you well because it will make you more aware of this dependence and you can make a cognitive effort not to be. "
947,"I am happy that you were able to see yourself in so many pieces of art. This really shows you have a great understand of self awareness. I think if I saw that \""""application accepted\"""" picture i would have felt the same way. I think that you last quote is something that everyone should hear. College is an experience where you find out who you are. "
948,It is great that you got to do something that is atypical of your schedule. Music is a huge relaxer and i believe that it is one of the major things that kept me sane during my time at PSU. I suggest you continue to use music as a stress reliever.
949,"The beauty of PSU is something that will have many people in awe. I am happy you got to experience that. You seem to have the concept of \""""Self-awareness\"""" completely. "
950,That is what this event was all about. Being open to trying new things will be a reoccurring theme in your life a PSU. Allow this great experience to show you that you can have a great time doing some thing that you have never done before.
951,I love that you are visits the arboretum with classmates. You showed all the skills that you listed above the entry. Great post
952,"Cool, I\'m sure kids will love this! Keep us updated on how this pans out, I would love to read more of your entries. "
953,"Ah, so many of your entries are about contests, you’re leaving me hanging with the results! Not only are you a very creative person Joel, but a great thinker under pressure, which speaks volumes. Nice job!"
954,Very well said Vanna!  I can see your core values in action at each of our sessions and in my encounters with you at speaker luncheons.  Keep it up!
955,"One of my favorite cheesy sayings is, “a chain is only as strong as its’ weakest link.” You’ve definitely captivated this saying, and applied it to your roll as a leader, kudos! Self-awareness is a rare but important attribute, making you a valuable asset to any team or organization. This is awesome!"
956,"“A group becomes a team when each member is sure enough of themselves and their contribution to praise the skills of others,” is a cheesy quote I like to remember when it  comes to teamwork. You seem to not only understand this, but apply it to yourself, kudos to you! I would love to read more entries where you further explore who you are in team settings!"
957,"“Team work makes the dream work,” is a cheesy phrase I love to annoy my coworkers with! It’s great you recognize the value of working cohesively with a team, this is important both in and out of the classroom. Keep up the good work!"
958,"This is awesome Nikki, you did a nice job in both summarizing and reflecting. Your ability to channel what you learned in cheerleading to potential workplace scenarios gives great insight to potential recruiters. Kudos!"
959,It was such a pleasure meeting you & spending time with the rest of the WLI class!
960,"I think this is a great point to be aware of. I think many times our negative opinions of conflict effect our ability to deal with conflict. If we regard conflict as a way to have a positive outcome, all parties benefit. Great insights Abby!"
961,Hi Tori.  I admire that you gained new perspective on the art of failure here.  It\'s never easy to feel like you\'ve disappointed others or yourself.  It shows real leadership and growth when you can take those moments and learn from them.  I think that\'s when greatest growth occurs.
962,"Kylyn, as I read your reflections, remind me of one the greatest leaders in sprituality and human justice said \""""the best way to find yourself, is to lose yourself in the service of others.\"""" — Mahatma Gandhi. "
963,"It sounds like your brother is a wonderful role model! There are indeed numerous opportunities to be a part of PSU and pursue your passion. Here is the searchable directory of student organizations:https://studentaffairs.psu.edu/hub/studentorgs/orgdirectory/ And, of course, if we do not have a club of interest, you too, can start your one. Have you thought about joining one of the Spanish clubs on campus?  "
964,"Catie, this is a great experience to share.  Often company policies can get in the way of being human.  Great job reading past just the declined cards and asking your manager for assistance.  Kudos to your manager as well for giving that bit of space the person needed to catch up on their finances.  Great work!"
965,I love this post. I can especially emphasize with being dragged to places by a significant other. It can really take away from the beauty of a place. But I\'m happy that you went back and gained a new perspective. Great imagery in this post.
966,These are all PSU must stop place when someone visits state college. They all tell the magical story of PSU. I also like how you suggested people should visit Beaver Stadium on non-gamedays. This is important because for people that don\'t go to PSU they can sometimes only think of Penn State as a football community but there is much to it than that.
967,"This campus has a lot of things to offer, including an expansive history. Im happy that you were able to enjoy the museums and feed your curiosity. It is important to stay curious while studying at PSU because it will lead to finding out exactly what you want to do with your life. "
968,This is great. Always lean on music because it is really good for stress management. Also I like how you tied it back to when you use to play an instrument in high school. It is important to keep music as a stress reliever because throughout your years at PSU you will have to deal with a lot of deadlines and assignments.
969,this is a great post. Life can fly by in the blink of an eye. Thats why I think you are on a good path by taking the time to go to arboretum and reflecting on life\'s events. This will allow you to see how far you have come and where you want to go.
970,This is great. You are ahead of most freshmen by reaching out to alumni so early. Continue to do this because having a good network is very important at PSU and in the real world. Plus these conversations will help you learn exactly what you want to do with your life.
971,I had John Water in undergrad he is a great teacher so i know you learned some great information. IT is very important to find a balance of studying long enough but not too much that you are unable to perform well on the exam. This advice will serve you well as the number of assignments you will have increase.
972,Privacy is very important thing to consider in this day of social media. Everyone knows everything about everyone which can lead people to paint a different picture of who they are to others. SO i think this talk was a great step in the right direction for the new generation to learn that privacy is a person\'s right that should be honored
973,That horse picture is exactly what college is like. Its an uphill battle but once you get to your destination you will be able to appreciate all of your hard work. I think you should continue visiting places like this that cause you to reflect on your like because it will allow you to see how far you have come.
974,Wow this is a great experience. Its different than most people and shows your desire to learn about medicine at a young age.
975,I love that you went to this event with 2 other classmates. In your classes is where you will develop relationships with people that will turn into your best friends. Also networking with others in the HHD college will serve you well for future class study groups.
976,Art is a beautiful thing that inspires nostalgia and reflection. I think this post is good because you are showing growth. You started off the story by saying you hated museums but now after this experience you have changed your mindset.
977,this post shows several skills that will serve you well in your future.
978,Having that balance of transparency and privacy is very important. It will allow you to be successful in life. Continue to open up to people but only those that you can trust. You have definitely developed your critical thinking skills
979,"Kudos to you, I can’t stand running! Here, I would love to read specific examples of how you used teamwork, critical thinking and your physical abilities to place in the top two finishers!"
980,"Hey Andrew, thanks for sharing! Team work makes the dreamwork seems to be your motto here! Consider sharing about a specific time you worked with your team. Maybe you took up the leader roll, or proposed a solution to a problem! In not just summarizing, but reflecting, you allow for deeper insight into the way you think!"
981,"That is a long list of accomplishments, kudos! I would love to read more stories about your time spend working at the warehouse, it seems you’ve been there for quite a while. Keep up the good work!"
982,"Andrew, this is awesome! This is a great example of what can happen when you pursue something you’re passionate about. Keep up the good work!"
983,I believe it is great that you are holding on to the values and lessons your grandparents have taught you
984,Great example of community engagement. These are the types of things we like to see in this Live IT posts
985,This is REALLY great that you stuck with something for this long so far! It really shows perseverance and dedication to what\'s important to you as far as careers.
986,"This is also a great leadership experience, I would add this in your tags as well! "
987,This is a very impressive project to be involved in. I highly suggest joining and participating in more experiences like this either with clubs or on your own to keep up with what you\'re doing.
988,Congratulations! That is an amazing thing to be proud of. Definitely keep involved in events such as these!
989,This was a very impressive way to describe a fraternity social chair. This post describes your position in the exact terms of professionalism people like to see.
990,This was an interesting experience to write about. You were able to take a simple visit to friends in another university and pull your skills learned out of it. I applaud this post and hope to see others like it in the future!
991,This is a very impressive post. It really shows the knowledge you have of your field and of your projects. It is great you are working with the Navy as well! Thank You!
992,This is a great experience to have. I highly suggest further creating more Posts like this with experiences you have had working with Navy research.
993,This is impressive you connected the experience back to your major and passions. I highly suggest further
994,This is impressive you connected the experience back to your major and passions. I highly suggest further immersing yourself in experiences such as these.
995,"From the Live It team and I- congrats on finishing the semester!  I know that the commenting feature isn\'t meant for messages like these. But, I\'m reminding you that as you enjoy your winter break, recruiters will continue to view your portfolios and in search of potential interns or hires. The more quality stories you have, the more likely you are to start that dialogue with your next employer. I encourage you to log in and check for comments or messages. Happy holidays!"
996,"From the Live It team and I- congrats on finishing the semester!  I know that the commenting feature isn\'t meant for messages like these. But, I\'m reminding you that as you enjoy your winter break, recruiters will continue to view your portfolios and in search of potential interns or hires. The more quality stories you have, the more likely you are to start that dialogue with your next employer. I encourage you to log in and check for comments or messages.   Happy holidays!"
997,"From the Live It team and I- congrats on finishing the semester! I know that the commenting feature isn\'t meant for messages like these. But I want to give you a heads up: as you enjoy your winter break, recruiters will continue to view your portfolios in search of potential interns or hires. The more quality stories you have, the more likely you are to start that dialogue with your next employer. I encourage you to log in and check for comments or messages. Happy holidays!"
998,"From the Live It team and I- congrats on finishing the semester!  I know that the commenting feature isn\'t meant for messages like these. But I want to give you a heads up: as you enjoy your winter break, recruiters will continue to view your portfolios in search of potential interns or hires. The more quality stories you have, the more likely you are to start that dialogue with your next employer. I encourage you to log in and check for comments or messages.   Happy holidays!"
999,"From the Live It team and I- congrats on finishing the semester!  I know that the commenting feature isn\'t meant for messages like these. But I want to give you a heads up: as you enjoy your winter break, recruiters will continue to view your portfolios in search of potential interns or hires. The more quality stories you have, the more likely you are to start that dialogue with your next employer. I encourage you to log in and check for comments or messages.   Happy holidays!"
1000,"From the Live It team and I- congrats on finishing the semester!  I know that the commenting feature isn\'t meant for messages like these. But I want to give you a heads up: as you enjoy your winter break, recruiters will continue to view your portfolios in search of potential interns or hires. The more quality stories you have, the more likely you are to start that dialogue with your next employer. I encourage you to log in and check for comments or messages.   Happy holidays! "
1001,"Eclair, this is a great experience and what could be better as a Wahoo to keep a 5-year commitment to maintain engagement.  You can use Live It for this, let us know if you want to try it.  Great work."
1002,Nice!
1003,Well done!
1004,Making sure a comment can be left.
1005,Good job!
1006,tc
1007,Thanks
1008,I like your story Alex!
1009,I really do!
1010,"I noticed that my other team members had no problem speaking with him, so I picked one who would understand why I was asking this of her, as well as willing to ask him to complete tasks. It was only a summer semester, but if it had been longer, I would have sat down with him to create a resolution, discussing where we go from there. I never found out the exact reason he did not want to listen to me, but I have hypothesized a few potential reasons, from him not taking """"orders"""" well, to myself, and not what I said to him, but how I said it. I have learned that I need to understand that tone can change the meaning of a conversation, and to create a open environment for critiques, even towards myself. "
1011,This is a comment
1012,Is this comment under the pending tab?
1013,Nice profile
1014,Can you see this?
1015,But you can't see this?
1016,I love animals...what have you learned?
1017,Which one are you?
1018,@Catherine Hall - 4th from the left!
1019,Nick this was awesome!  Thank you!
1020,Very cool!
1021,I like it  It's clean an it's ongoing
1022,Very insightful!
1023,"Thank you for sharing this Kristine.  To be fair, I'm not sure I've found myself at 33. Life, especially when you are ambitious, is a trial in learning and perseverance.  My family didn't understand why I chose to get a Masters degree or move around the country repairing broken school systems.  They saw the immediate need for me to be safe and secure.  What you are proposing is brave and 1 skill you will want is the ability to ask for help.  Not from a place of weakness but rather self-awareness. TY"
1024,Very interesting!
1025,I'm done
1026,Nice pic Emily
1027,Nice boys have a nice afternoon today
1028,hello
1029,yaaaaaaassss
1030,Hi
1031,I love swimteam
1032,You spelled course wrong.
1033,"Devin, good job so far. Remember to capitalize your'""""I's."
1034,cute photo :3 and I'm impressed
1035,Some of the periods need to be commas.
1036,maybe you could add more sentences to your first entire
1037,Hey this is good.
1038,Add more to your color run add more detail
1039,Fix the area with the random period.
1040,I think your a sweet girl Carley. I loved this post because this reminded me of how much I love to help my mom whenever I can or if I have time to. Thank you.
1041,add periods
1042,add more paragraphs
1043,put space after period
1044,Good paragraph.
1045,Theres really nothing for me to judge here. It's all beautiful in so many ways.
1046,You need a comma between interest and I
1047,capitalize i's
1048,"I am very sorry, but I think that what you did was great."
1049,Add the word out after help.
1050,I love the detail
1051,Love it Nikki
1052,I like this stuff and I do this stuff because I have to.
1053,I go there too
1054,Can you talk about your skills? It is kind of the point of this you know.
1055,Great entry!
1056,I like hunting too
1057,I liked them. Maybe explain a little more.
1058,This paragraph is interesting and you helped me visualize street cleaning well.
1059,it could be a good paragraph if it was longer.
1060,This was the only one there at the time so it was my favorite. Make sure you have longer paragraphs :)
1061,"Good job, but watch for the I"
