,comment_body
176,I highly suggest elaborating more on how the movie pertained to you and your skill development. This will show recruiters the process of how you develop your skills.
177,Sounds wonderful . . . looks beautiful.
178,I think that we often forget that small steps can lead to a larger goal.  Kudos to you for starting a business that is supported by your community!
179,This is great to place in your portfolio.  It shows you are willing to take risks!
180,This is excellent!!! I would like to place my oder now for the holidays.  Do I order them at school?
181,You could add more here because these are such cool projects! :)
182,Way to go! I\'d love o buy a pie. :)
183,was this at PVEI?
184,This pie look delicious.  Do you deliver?
185,Just watch the camera footage the next day.
186,There was no better training for Administration than customer relations.  Nice job.  I need to work on my picture skills.
187,That was a wonderful event.  You guys did a great job making that night a positive experience for the kids.
188,Great details within your description...
189,Excellent initiative.  Are you planning to sell any at work soon?
190,How cute! What a nice way to spend community service hours helping a baby bird!
191,Maybe you could include how much money you raised.  What was your role?
192,Woohoo!
193,I love this description- the kids submitted many awesome pics for this event for yearbook.  It was an amazing team building activity.
194,Wow! This should be nominated for Principal of the Year.
195,Hooray for mental health!!  ;)
196,I have decided that if I make it to 2022 I will come visit.  Invited or not!!!!!!
197,How did going to camp next to a sublime ocean make you feel?
198,Great example of some soft skills and an experience that would be good interview discussion.  Just take another look at your last sentence.  It has at least one type and doesn\'t read quite right.
199,It would be great to make another entry/reflection on this class now that you are half-way through the course.  Would love to read about what you have learned about yourself and others!
200,Well done writing succinctly but in a meaningful way how you relate to these three different works and what they symbolize for you.
201,You should look in to our Maymester trip to Lyon France. It is a wonderful opportunity to explore both cuisine and culture and you could practice your French language and get some of those skills back (in a hurry I suspect.)
202,"Just a quick comment...we would say \""""learned\"""" not learnt.  Perhaps expand on the \""""field\"""" business knowledge you have gained as well particularly related to \""""soft skills\"""".  A separate entry on this with specific examples of experiences that helped you build these skills would expand a future employer\'s understanding of what you can do."
203,Good job of pulling together three descriptions of artworks and how they relate to your life.  Do proof read your entry again and correct the typos (or spelling/grammar) errors.  I think if you read carefully you will find them.
204,I don\'t know if there is a tag for perseverance but it so I would add it to this entry.
205,This is really cool once again another great opportunity to be involved in!  I suggest throwing in this post a specific situation you had that you overcame during this project.
206,I highly suggest further elaborating on your learning experience of R programming. Yet again another great thing to be involved in.
207,This is fantastic!!! As a fellow gamer I find it really impressive that you go out of your way to do things other women have not really stepped heavily into yet! This also shows a great deal of organization with the size of your group.
208,I would elaborate further on this experience to give the reader a better understanding of the exhibition and what was done pertaining to your skills.
209,These are nice reflections on your favorite paintings. I highly suggest creating another post that specifically reflects on your skill development based on one painting you connect the most with.
210,This was a very good and detailed summary of the movie. However rather than discussing details of the movie you should further reflect on your experiences and how the movie inspired you to develop these skills in the tags.
211,I am glad you enjoyed this experience! I highly suggest further reflecting on the experience by discussing the building of your skills in the skill tags and connecting it back to your summary of your experience.
212,This post was developed very well. I like that it showed your thought process on the exact flavors. Your style and tone of writing also helped to better tell the story to your audience.
213,This was a good summary of your experience. However I highly suggest specifically self-reflecting toward your skills used in the creation of bowls. You can show this by discussing your thought process with the audience.
214,This was a very good summary of the movie. However your post should be more focused on self-reflecting on the skills you used or developed based on the movie.
215,This was a good summary of the event and self-reflection on teamwork as a whole. However I highly suggest further elaborating on your experience personally in relation to your skills in the skill tags.
216,This was a great summary about the movie. However I highly suggest further elaborating on your self-reflection of the skills you either used or developed in result of this movie.
217,This was a very interesting grabber to start with. I highly suggest further self-reflecting on the movie experience to tie back to your development of the skills mentioned in the tags.
218,It is nice that you got to know your teammates better during this team building activity. I would continue this reflection by further explaining the experience tied back to your skills mentioned in the tags.
219,This was a good summary of the movie. However I highly suggest further self-reflection upon your developed or used skills from the tags and tie this back to the movie summary and experience.
220,This was a very good summary of the movie. However I highly suggest connecting this movie back to your experience based upon the ideals of the movie with developing your skills.
221,This was a nice summary of the experience you had at green bowl. However I highly suggest self-reflection further on the creation of the bowl your thought process and how this effected you your team
222,This was a good short summary of the green bowl experience. However I am not sure if you understand how to use these posts to your advantage. You should use this scenario as an opportunity to self-reflect on the skills you developed or used during this experience.
223,This is a good summary of the movie however I suggest using these posts as a tool to further frame your skills and how you can tie them back to a certain scenario in the movie.
224,So what is it about MakeSpace that made it worth it for you that helped you to develop these skills?
225,Good stuff
226,This is good! Your take away is stronger here but still consider expanding on it. Explain to me how your critical thinking in a hypothetical space situation could be applied here on earth!
227,This sounds like it was a good experience. You should further elaborate on this post to show the development and usage of your skills!
228,This was a great experience to write about.  This was a good stepping stone back story post for the more recent posts you have.
229,"Luke you are the living example of \""""alone we can do so little together we can do so much \"""" and that is amazing! Your behind the scenes contribution helped to make THON be the best it could be"
230,So glad to hear you found this engaging and are excited to explore further.  This was a first for my PSU14 sections so I\'m really glad it hit the mark for at least one student!
231,this was a good experience you had. However I highly suggest further explaining the skills you learned during this scenario. It will better help recruiters understand the way you develop and use skills.
232,I highly suggest futher building on this post by elaborating more thoroughly the development and usage of your skills.
233,Hey Wonsuk thanks for sharing! Your summary of the movie is strong but try to connect the events of the movie to yourself. Consider reflecting upon your major if you yourself have ever faced adversity and if so
234,This was a great summary of your experience however i highly suggest further elaborating on your actual use of your creativity skill tag or development of the skill.
235,This is great that you described the movie to the audience However it would be most effective to you if you further explained how you developed or used your community engagement skills.
236,What\'s up Jeffrey! Thanks for sharing your experience this is a great entry. Your takeaway here is really strong but I wold love to hear a little more background as to what you did at Green Bowl. Consider this when creating future Live It entries!
237,"Just one quick correction to make...\""""wedding party\'s\"""" is possessive.  You need to use the plural which would be \""""wedding parties.\""""  Good illustration of thinking on your feet and keeping good customer service in mind!"
238,What\'s up Jonathon! This is a great entry you not only shared your experience but reflected upon it as well. This is a great way to show your value in the classroom and workplace. Keep up the good work!
239,"The entry is good but consider unpacking it a little more. Give more background on the experience in order to explain how you came to conclude it would help to enable teamwork! Remember \""""reflective thinking turns experience into insight.\"""""
240,I would use this continuation to further explain your personal use of the skills.
241,Hey Jason this is a great entry! Not only did you summarize you experience but you reflected upon it and gave a great takeaway nice! If you haven\'t already
242,You\'re killing it Jason this entry is very strong as well. I really enjoy your playful writing style I can practically envision your confidence when creating the bowls. Kudos to you keep up the good work!
243,This looks like an awesome experience Ricky.  I would love to hear this better version of \'Super Bass\'.  I certainly don\'t have the talent to perform but respect the courage it took to get on stage and nail a song.  Congrats.
244,CAD is a super useful skill to have! It is great you voiced this technical skill in addition to your soft skills in this post!
245,This is a really great organization to get involved in. THON is recognized by many people everywhere you go helping people like this shows the heart and caring you have for people which is great in a workplace environment and life in itself.
246,All these experiences of leadership and community involvement are great! Keep up the good work!
247,This was a great summary of the movie. Howevr I highly suggest specifically showing how this movie helped you develop the skills rather than how Mark developed skills.
248,I really think that you should expand on this post based on your skills you put as the tags.
249,I highly suggest in the future tying back the movie contents to your personal skills learned and used based on the events in the movie.
250,I love that you are visits the arboretum with classmates. You showed all the skills that you listed above the entry. Great post
251,Nice I hope you did well in the competition! Consider strengthening this post by adding a takeaway or in other words a sentence to wrap up both your experience and your reflection!
252,What’s up Eclair thanks for sharing your experience! While your post is great you can strengthen it by not just summarizing but reflecting as well! By reflecting you’re giving potential recruiters insight into not just your skills
253,Very well said Vanna!  I can see your core values in action at each of our sessions and in my encounters with you at speaker luncheons.  Keep it up!
254,While this is true i’m not sure you’ve expressed how this pertains to you. Instead of just stating something you believe consider giving an example of a time you practiced this then reflect upon it to give further insight!
255,Cool I loved volunteering in high school too! This demonstrates valuable aspects about you both professionally and personally kudos! Consider getting involved with volunteer initiatives at Penn State if you haven’t already
256,It was such a pleasure meeting you & spending time with the rest of the WLI class!
257,"Kylyn as I read your reflections remind me of one the greatest leaders in sprituality and human justice said \""""the best way to find yourself is to lose yourself in the service of others.\"""" — Mahatma Gandhi."
258,This is exactly what we want in these posts. I learned a lot about your determination perseverance and desire to work with people. Continue to refine these traits and you will be successful in your time at PSU.
259,This campus has a lot of things to offer including an expansive history. Im happy that you were able to enjoy the museums and feed your curiosity. It is important to stay curious while studying at PSU because it will lead to finding out exactly what you want to do with your life.
260,This is great. Always lean on music because it is really good for stress management. Also I like how you tied it back to when you use to play an instrument in high school. It is important to keep music as a stress reliever because throughout your years at PSU you will have to deal with a lot of deadlines and assignments.
261,The arboretum is good for making someone nostalgic. These moments allow you see how far you have come and where you want to go. I suggest you continue going to the arboretum if its one of the only things that sparks this reflection because it is important for your development.
262,this is a great post. Life can fly by in the blink of an eye. Thats why I think you are on a good path by taking the time to go to arboretum and reflecting on life\'s events. This will allow you to see how far you have come and where you want to go.
263,I had John Water in undergrad he is a great teacher so i know you learned some great information. IT is very important to find a balance of studying long enough but not too much that you are unable to perform well on the exam. This advice will serve you well as the number of assignments you will have increase.
264,Privacy is very important thing to consider in this day of social media. Everyone knows everything about everyone which can lead people to paint a different picture of who they are to others. SO i think this talk was a great step in the right direction for the new generation to learn that privacy is a person\'s right that should be honored
265,That horse picture is exactly what college is like. Its an uphill battle but once you get to your destination you will be able to appreciate all of your hard work. I think you should continue visiting places like this that cause you to reflect on your like because it will allow you to see how far you have come.
266,Wow this is a great experience. Its different than most people and shows your desire to learn about medicine at a young age.
267,I love that you went to this event with 2 other classmates. In your classes is where you will develop relationships with people that will turn into your best friends. Also networking with others in the HHD college will serve you well for future class study groups.
268,Art is a beautiful thing that inspires nostalgia and reflection. I think this post is good because you are showing growth. You started off the story by saying you hated museums but now after this experience you have changed your mindset.
269,this post shows several skills that will serve you well in your future.
270,I believe it is great that you are holding on to the values and lessons your grandparents have taught you
271,as your mentor I can say post college is when I started really getting in tune to nutritional health and using vitamins. I also use calorie counting apps as a way to monitor nutrients intakes because it makes it a game to see how perfect I can plan my meals!
272,This sounds like a great exhilarating experience to have. This really shows your dedication to be involved even off-season.
273,This was a great class to be involved in. The vocabulary In this post shows your audience you really know what you\'re talking about with this project.
274,This is REALLY great that you stuck with something for this long so far! It really shows perseverance and dedication to what\'s important to you as far as careers.
275,Congratulations! That is an amazing thing to be proud of. Definitely keep involved in events such as these!
276,This was a very impressive way to describe a fraternity social chair. This post describes your position in the exact terms of professionalism people like to see.
277,That is very impressive you were able to raise the overall GPA. A lot of times GPAS will fluctuate substantially in college however this shows the dedication you had to being at the top and bringing everyone with you along the way. This is a huge factor in proper leadership.
278,This is an impressive internship to have! Keep up the good work and keep involved in experiences such as these that will propel you further into your field and prepare you for your career!
279,This is a really good event to experience to help you learn and grow throughout your time in college. Definitely keep these events in mind and attend them when you can they will really help you for your future and in helping decide what you may be happiest doing.
280,Helena this sounds like an amazing opportunity and experience.  No one knows more about what a work day looks like for a public servant like a \'receptionist\' for community issues.  Great work.
281,This post shows your attachment to perfection and doing things correctly. This is crucial in any work field and is great you showed this in your post!
282,Glad to hear that you gave it a little time in ME so you REALLY knew that it was not the right career path for you!  No looking back....only forward from here on out!
283,Nittany Lion Inn is a great place to start!  Next you will have the skills training and confidence to take a big step into cooking in a larger environment!
284,Being an example of good physical and mental health shows younger women everywhere that we CAN do it all.
285,Nice job filling out your overall profile.  This competition sounds pretty cool - good luck to you and your team!
286,THON is a great organization and I am glad you were able to share the experience with others. The longest I danced in the stands was 21 consecutive hours.
287,You have an insightful outlook. To ensure your health you need to make time for yourself. Below is an article I found helpful when I was building myself.http://www.lifehack.org/articles/featured/how-to-find-time-for-yourself.html
288,Nice!
289,Great!
290,Well done!
291,Making sure a comment can be left.
292,Good job!
293,Hello
294,nice
295,reply
296,tc
297,Great work volunteering Alyssa finding the grand compromise of efficiency and quality will serve you well in every future experience. Great work!
298,Thanks
299,reply 2/1
300,my reply
301,Great reflection!
302,lol
303,Thanks Kristine! And I do see myself having a management position in the future. I think one of my strongest assets is my ability to lead people.
304,I like your story Alex!
305,I really do!
306,I noticed that my other team members had no problem speaking with him so I picked one who would understand why I was asking this of her as well as willing to ask him to complete tasks. It was only a summer semester but if it had been longer I would have sat down with him to create a resolution
307,This is a comment
308,Is this comment under the pending tab?
309,Nice profile
310,Can you see this?
311,But you can't see this?
312,Hey this is a comment from 2/23
313,Thanks for adding your thoughts here Joanne.  How have our sessions at the school met or challenged your expectations?
314,Hi thank you for the comment. Are you the only one who are responsible to make comments?
315,That's a great quote!
316,This seems like it was a great experience. I encourage you to think about how debating someone in a professional manner can stretch across your career opportunities. It is a tough skill to master but allows you to grow professionally.
317,I love animals...what have you learned?
318,Which one are you?
319,@Catherine Hall - 4th from the left!
320,Nick this was awesome!  Thank you!
321,Very cool!
322,I like it  It's clean an it's ongoing
323,Very insightful!
324,Thank you for sharing this Kristine.  To be fair I'm not sure I've found myself at 33. Life especially when you are ambitious is a trial in learning and perseverance.  My family didn't understand why I chose to get a Masters degree or move around the country repairing broken school systems.  They saw the immediate need for me to be safe and secure.  What you are proposing is brave and 1 skill you will want is the ability to ask for help.  Not from a place of weakness but rather self-awareness. TY
325,Very interesting!
326,Thanks!
327,Dominic I am so happy to read your story and know why you like cars so much.  Always have curiosity on everything. Stay hungry stay foolish.
328,That was an awesome story Dominic! It's awesome to hear about how you could  connect with you grandfather.
329,Chloe I am glad that you find another interest. Having and learning more skills will do no harm to your future career.
330,Barry though people say video games are bad for children because they make you addicted to virtual world I believe that video games help you be more creative. I am so happy for you.
331,I am excited for you! i am very glad that you are taking up this leadership role. I know you will do exceptional!
332,I am so glad you enjoyed your time in Spain. Getting to experience another culture is a very fulfilling experience!
333,That's a great lesson to take away from your experience Chloe. We all need things that bring joy to ourselves. Keep up the good work!
334,France is a very beautiful place. I have been there a couple of times with my family. French is one of the  three languages i speak. I know you will have fun with your family.
335,Hey Barry its great to see that you got through your presentation. Confidence is key good job!
336,I am glad you are a part of the band. I look forward to hearing you perform. Let me know the date of your first performance
337,Autumn I am sure that you have done well in your swim competition no matter what place you got. Every one of you should learn that the most important thing in your life is not reputation nor prizes but friendship experience
338,You or others in your network can comment on your entries. Professors could leave feedback on your experiences or entries as well as other students.
339,Nice ATV! I also have one. Had a very similar situation.
340,I'm done
341,Nice boys have a nice afternoon today
342,yaaaaaaassss
343,I love swimteam
344,You spelled course wrong.
345,I've
346,cute photo :3 and I'm impressed
347,Some of the periods need to be commas.
348,maybe you could add more sentences to your first entire
349,Hey this is good.
350,Add more to your color run add more detail
351,I think your a sweet girl Carley. I loved this post because this reminded me of how much I love to help my mom whenever I can or if I have time to. Thank you.
352,add periods
353,You forgot the space between the words each and other
354,I like this entry the best because I feel like you expressed yourself the most.
355,Thank you for saying I think that is very nice of you
356,Capitalize the I s
357,add more paragraphs
358,put space after period
359,Good paragraph.
360,You need a comma between interest and I
361,Make it longer please.
362,capitalize i's
363,I am very sorry but I think that what you did was great.
364,Add the word out after help.
365,I love the detail
366,I go there too
367,I liked them. Maybe explain a little more.
368,it could be a good paragraph if it was longer.
369,I think that you should add more of a reason about why you like sports and I like how it tells me all of the sports that you do.
370,I also help tutor in 6th grade.
371,You broke a bone in Mexico? Cool.
372,i think that you need to be more descriptive with your color run piece.
373,I like how you show your enjoyment in the sport you play.
374,I go to a youth group in pvyc
375,You should be more specific
376,I love the topic!
377,I liked the detail.
378,I like the way you still have fun even if you don't win.
379,I like gaming to my life is on my Xbox.
380,This is an impressive paragraph. Good job using details!
381,Helping the community is cool.
382,I can relate
383,change the we plz
384,You need more in your paragraph
385,good job
386,I had lots of fun at your Mini-THON! I enjoyed reading more about what you guys accomplished
387,I love to draw as well
388,competitions
389,You still need two more entries. But good start to your first entry.
390,This is a great paragraph but there was a spelling error and some info didn't make sense.
391,where you ride..
392,Maybe mentioning memes isn't the greatest idea. I love memes as well as the next guy but maybe some professional photoshops would be more appropriate?
393,how was your  first experience?
394,This looks good...will be nice if in 2-3 years you actually achieve your goal.
395,to many lower case I s
396,"You said """"teh"""" instead of """"the"""""
397,This a great post!
398,More sentences!!!!!!!!!!!!!!!!!!!!!!!!!!!!!!
399,watch for ' this in you conjunctions
400,MORE CONTENT
401,Needs way more details and description. Need a picture. This is not a paragraph this is one sentence.
402,"You missed 'I'. The only things I find wrong in this is that the paragraph is too short and that it should be and I am"""" instead."
403,Good
